{
  "eventId": "123456789012345",
  "eventType": "VITAL_SIGN_REPORTED",
  "schemaVersion": 1,
  "occurredAt": "2026-07-24T02:30:00Z",
  "traceId": "trace-c04-001",
  "producer": "service-iot@1.0.0",
  "payload": {
    "sourceMessageId": "mqtt-vital-001",
    "device_id": "MATTRESS-001",
    "elder_id": "42",
    "data_time": 1784860200000,
    "heart_rate": 75,
    "respiratory_rate": 16,
    "body_movement": 1,
    "bed_status": "IN_BED"
  }
}
